{
	"$schema": "https://raw.githubusercontent.com/CeladonSS13/Shiptest/beta-dev/_maps/_mod_celadon/ship_config_schema.json",
	"map_name": "Iron-class Assault Boat Mk.II",
	"map_short_name": "Inteq-Iron-Maiden",
	"description": "Тяжелое десантное судно класса 'Iron' или известного как Утюг, модификация Марк 2, представляет собой последний штрих в области десантных операций. Отсеки судна были переработаны с учетом опыта предыдущих боевых действий, что повысило безопасность при штурме судна. Производимый корпорацией InteQ, это судно широко используется в качестве десантного судна на кораблях-носителях, но также способен выполнять самостоятельные полеты в пределах солнечной системы. Разработанный в начале конфликта с другими корпорациями, он представляет собой более доступную альтернативу сложным и дорогостоящим судам. Известный своим прямоугольным корпусом и мощной броней, Марк 2 обеспечивает надежную защиту для десантников в самых опасных условиях. Несмотря на то, что это судно прослужило уже не одно десятилетие, его популярность не угасает благодаря простоте и высокой степени надежности.",
	"map_path": "_maps/_mod_celadon/shuttles/inteq/inteq_iron_maiden.dmm",
	"enabled": true,
	"limit": 1,
	"sensor_range": 3,
	"prefix": "LIQSV",
	"faction": "/datum/faction/inteq",
	"tags": ["Боевой"],
	"namelists": [
		"MYTHOLOGICAL",
		"BEASTS",
		"NATURAL_AGGRESSIVE",
		"INTEQ"
		],
	"job_slots": {
		"Vanguard": {
			"outfit": "/datum/outfit/job/inteq/celadon/captain",
			"officer": true,
			"slots": 1
		},
		"Master At Arms": {
			"outfit": "/datum/outfit/job/inteq/celadon/enforcer",
			"officer": true,
			"slots": 1
		},
		"Artificer": {
			"outfit": "/datum/outfit/job/inteq/celadon/engineer",
			"slots": 1
		},
		"Corpsman": {
			"outfit": "/datum/outfit/job/inteq/celadon/paramedic",
			"slots": 1
		},
		"Enforcer": {
			"outfit": "/datum/outfit/job/inteq/celadon/security",
			"slots": 5
		}
		}
}
