{
	"$schema": "https://raw.githubusercontent.com/CeladonSS13/Shiptest/beta-dev/_maps/_mod_celadon/ship_config_schema.json",
	"map_name": "Hammerhead-Heavy Cruiser",
	"map_short_name": "Hammerhead",
	"description": "Тяжёлый крейсер InteQ класса `Hammerhead` - бывшее исследовательское судно Нанотрейзен, выкупленное и перестроенное для использования в секторах без поддержки основных сил. Судно предназначено для большой и сплочённой команды из четырёх и более человек. В ЩИТСПАВНЕ ПО ПРИЧИНЕ: Наличие ТЭГа убивает сервер!",
	"map_path": "_maps/_mod_celadon/shuttles/inteq/inteq_hammerhead.dmm",
	"enabled": false,
	"limit": 1,
	"sensor_range": 4,
	"prefix": "BIQSV",
	"faction": "/datum/faction/inteq",
	"tags": [
		"Боевой",
		"Инженерный"
	],
	"namelists": [
		"INTEQ"
		],
	"job_slots": {
		"Vanguard": {
			"outfit": "/datum/outfit/job/inteq/celadon/captain",
			"officer": true,
			"slots": 1
		},
		"Enforcer Class One": {
			"outfit": "/datum/outfit/job/inteq/celadon/enforcer",
			"officer": true,
			"slots": 1
		},
		"Master At Arms": {
			"outfit": "/datum/outfit/job/inteq/celadon/warden",
			"officer": true,
			"slots": 1
		},
		"Artificer Class One": {
			"outfit": "/datum/outfit/job/inteq/celadon/ce",
			"officer": true,
			"slots": 1
		},
		"Enforcer": {
			"outfit": "/datum/outfit/job/inteq/celadon/security",
			"slots": 4
		},
		"Artificer": {
			"outfit": "/datum/outfit/job/inteq/celadon/engineer",
			"slots": 2
		},
		"Corspman": {
			"outfit": "/datum/outfit/job/inteq/celadon/paramedic",
			"slots": 1
		},
		"Recruit": {
			"outfit": "/datum/outfit/job/inteq/assistant",
			"slots": 4
		}
	}
}
