{
	"$schema": "https://raw.githubusercontent.com/CeladonSS13/Shiptest/beta-dev/_maps/_mod_celadon/ship_config_schema.json",
	"map_name": "Vaquero-class Light Frigate",
	"map_short_name": "Vaquero",
	"description": "'Vaquero' - это гибкая и дешевая военная модификация малого коммерческого грузового судна, широко используемая InteQ Risk Management Group для патруля, разведки и сопровождения, а также для контрактов, которые не требуют более крупного и специализированного судна. В отличие от большинства суден InteQ, Vaquero оснащен базовым медицинским, инженерным и военным оборудованием, а его минимальные требования к экипажу отлично подходят для Vanguards с небольшим командованием и для учебных миссий. Как и любой другой корабль Интек, он оснащен большим грузовым отсеком, который может быть изменен по мере необходимости.",
	"map_path": "_maps/_mod_celadon/shuttles/inteq/inteq_vaquero.dmm",
	"enabled": true,
	"limit": 1,
	"sensor_range": 6,
	"prefix": "LIQSV",
	"faction": "/datum/faction/inteq",
	"tags": [
		"Боевой"
	],
	"namelists": [
		"BEASTS",
		"INTEQ"
	],
	"job_slots": {
		"Vanguard": {
			"outfit": "/datum/outfit/job/cel/inteq/captain",
			"officer": true,
			"slots": 1
		},
		"Master At Arms": {
			"outfit": "/datum/outfit/job/cel/inteq/warden",
			"officer": true,
			"slots": 1
		},
		"Artificer": {
			"outfit": "/datum/outfit/job/cel/inteq/engineer",
			"slots": 1
		},
		"Corpsman": {
			"outfit": "/datum/outfit/job/cel/inteq/paramedic",
			"slots": 1
		},
		"Enforcer": {
			"outfit": "/datum/outfit/job/cel/inteq/security",
			"slots": 1
		},
		"Auxiliary": {
			"outfit": "/datum/outfit/job/cel/inteq/assistant",
			"slots": 1
		}
	}
}
