{
	"$schema": "https://raw.githubusercontent.com/CeladonSS13/Shiptest/beta-dev/_maps/_mod_celadon/ship_config_schema.json",
	"map_name": "Schmiedeberg-class Pharmacology Ship",
	"map_short_name": "Schmiedeberg",
	"description": "Интересуетесь фармакологией, но устали сидеть перед химическим дозатором и целыми днями нажимать на кнопки? Хотите совместить кулинарное искусство с наркотическим? Надеетесь совместить все эти качества с самым важным занятием - зарабатыванием толстых пачек денег? Тогда судно класса 'Schmiedeberg' для вас! В 'Schmiedeberg' находится мощная химическая лаборатория, высокопроизводительная ботаническая установка и полноценная кухня-магазин, что делает его идеальным местом для химиков и ботаников, живущих в подворотнях.",
	"map_path": "_maps/_mod_celadon/shuttles/independent/independent_schmiedeberg.dmm",
	"enabled": true,
	"limit": 1,
	"sensor_range": 4,
	"prefix": "IMV",
	"faction": "/datum/faction/independent",
	"tags": [
		"Ботаника",
		"Медицинское"
	],
	"namelists": [
		"SUNS",
		"GENERAL"
	],
	"job_slots": {
		"Chief Pharmacist": {
			"outfit": "/datum/outfit/job/independent/cmo/pharma",
			"officer": true,
			"slots": 1
		},
		"Pharmacist": {
			"outfit": "/datum/outfit/job/independent/chemist/pharma",
			"slots": 1
		},
		"Mixologist": {
			"outfit": "/datum/outfit/job/independent/bartender/pharma",
			"slots": 1
		},
		"Herbalist": {
			"outfit": "/datum/outfit/job/independent/botanist/pharma",
			"slots": 2
		},
		"Pharmacology Student": {
			"outfit": "/datum/outfit/job/independent/assistant/pharma",
			"slots": 2
		}
	}
}

