{
	"$schema": "https://raw.githubusercontent.com/CeladonSS13/Shiptest/beta-dev/_maps/_mod_celadon/ship_config_schema.json",
	"map_name": "Colossus-class Armored Frigate",
	"map_short_name": "Colossus",
	"description": "Как и большинство суден InteQ, 'Colossus' является профессионально военизированным грузовым судном и рассчитан на длительную автономную работу, служа интересам IRMG и предоставляя жизненно важные услуги наемников везде, где они необходимы. Ключевыми особенностями судна являются надежный и хорошо укомплектованный арсенал и просторные помещения для экипажа, а также вместительный грузовой отсек, который экипаж часто переоборудует в дополнительное место для отдыха или тренировок.",
	"map_path": "_maps/_mod_celadon/shuttles/inteq/inteq_colossus.dmm",
	"enabled": true,
	"limit": 1,
	"sensor_range": 4,
	"prefix": "BIQSV",
	"faction": "/datum/faction/inteq",
	"tags": [
		"Боевой"
	],
	"namelists": [
		"MYTHOLOGICAL",
		"BEASTS",
		"NATURAL_AGGRESSIVE",
		"INTEQ"
	],
	"job_slots": {
		"Vanguard": {
			"outfit": "/datum/outfit/job/inteq/cel/captain/honorable",
			"officer": true,
			"slots": 1
		},
		"Master At Arms": {
			"outfit": "/datum/outfit/job/inteq/cel/warden",
			"officer": true,
			"slots": 1
		},
		"Artificer": {
			"outfit": "/datum/outfit/job/inteq/cel/engineer",
			"slots": 1
		},
		"Corpsman": {
			"outfit": "/datum/outfit/job/inteq/cel/cmo",
			"slots": 1
		},
		"Enforcer": {
			"outfit": "/datum/outfit/job/inteq/cel/security",
			"slots": 3
		},
		"Recruit": {
			"outfit": "/datum/outfit/job/inteq/cel/assistant",
			"slots": 5
		}
	}
}
