{
	"$schema": "https://raw.githubusercontent.com/CeladonSS13/Shiptest/beta-dev/_maps/_mod_celadon/ship_config_schema.json",
	"map_name": "Pangolier-class Cruiser",
	"map_short_name": "Pangolier",
	"description": "Судно класса «Pangolier» является результатом совместного сотрудничества Cybersun и Gorlex Marauders. Благодаря их совместному труду в краткие сроки некогда вышедшее из эксплуатации административное судно было отреставрировано и переоборудовано под длительные экспедиции, а также снабжено научным отделом. На судне находятся ведущие специалисты своих областей под командованием предоставленного Cybersun Капитана, в то же время для их защиты на судне расквартирована наемная группа Gorlex Marauders.",
	"map_path": "_maps/_mod_celadon/shuttles/syndicate/syndicate_pangolier.dmm",
	"enabled": true,
	"limit": 1,
	"sensor_range": 5,
	"prefix": "RSSV",
	"faction": "/datum/faction/syndicate",
	"tags": ["Исследовательский"],
	"namelists": ["CYBERSUN", "GORLEX"],
	"job_slots": {
		"Commander": {
			"outfit": "/datum/outfit/job/cel/syndicate/captain/cybersun",
			"officer": true,
			"slots": 1
		},
		"Commando": {
			"outfit": "/datum/outfit/job/cel/syndicate/security/gorlex",
			"slots": 2
		},
		"Scientist": {
			"outfit": "/datum/outfit/job/cel/syndicate/science/cybersun",
			"slots": 2
		},
		"Paramedic": {
			"outfit": "/datum/outfit/job/cel/syndicate/doctor/cybersun",
			"slots": 1
		},
		"Engineer": {
			"outfit": "/datum/outfit/job/cel/syndicate/engineer/cybersun",
			"slots": 2
		},
		"Junior Agent": {
			"outfit": "/datum/outfit/job/cel/syndicate/assistant",
			"slots": 2
		}

	}
}
