{
	"$schema": "https://raw.githubusercontent.com/CeladonSS13/Shiptest/beta-dev/_maps/_mod_celadon/ship_config_schema.json",
	"map_name": "Escape Pod X-03",
	"map_short_name": "EscapePod",
	"description": "Ваше основное судно было уничтожено, теперь вам нужно выжить.",
	"map_path": "_maps/_mod_celadon/shuttles/independent/independent_escapepod.dmm",
	"enabled": true,
	"limit": 1,
	"sensor_range": 2,
	"space_spawn": true,
	"prefix": "ЕSV",
	"faction": "/datum/faction/independent",
	"tags": [
		"Выживание"
	],
	"namelists": [
		"GENERAL",
		"SPACE",
		"NATURAL"
	],
	"job_slots": {
		"Captain": {
			"outfit": "/datum/outfit/job/cel/independent/captain/western",
			"officer": true,
			"slots": 1
		},
		"Ship's Doctor": {
			"outfit": "/datum/outfit/job/doctor",
			"slots": 1
		},
		"Ship's Engineer": {
			"outfit": "/datum/outfit/job/cel/independent/engineer",
			"slots": 1
		},
		"Asteroid Miner": {
			"outfit": "/datum/outfit/job/cel/independent/miner/hazard",
			"slots": 1
		},
		"Deckhand": {
			"outfit": "/datum/outfit/job/cel/independent/assistant",
			"slots": 1
		}
	}
}
