{
	"$schema": "https://raw.githubusercontent.com/shiptest-ss13/Shiptest/master/_maps/ship_config_schema.json",
	"map_name": "Bolt-class Scout Vessel",
	"faction": "/datum/faction/solgov",
	"prefix": "SFSV",
	"namelists": [
		"SOLGOV",
		"SPACE",
		"BRITISH_NAVY",
		"NATURAL"
	],
	"map_short_name": "Tomahawk-class",
	"map_path": "_maps/_mod_celadon/shuttles/solfed/solfed_lightning_bolt.dmm",
	"starting_funds": 0,
	"description": "Корабль Солнечной Федерации класса Bolt служит для фронтовой разведки с боем.",
	"tags": ["Разведка", "Бой", "Шахтёрство"],
	"limit": 1,
	"job_slots": {
		"Juggernaut": {
			"outfit": "/datum/outfit/job/solgov/bolt/captain",
			"officer": true,
			"slots": 1
		},
		"Scout": {
			"outfit": "/datum/outfit/job/solgov/bolt/bureaucrat",
			"officer": true,
			"slots": 1
		},
		"Assault": {
			"outfit": "/datum/outfit/job/solgov/bolt/security",
			"slots": 1
		},
		"Stormtrooper": {
			"outfit": "/datum/outfit/job/solgov/bolt/security",
			"slots": 2
		},
		"Paramedic": {
			"outfit": "/datum/outfit/job/solgov/bolt/medic",
			"slots": 2
		},
		"Demolitionist": {
			"outfit": "/datum/outfit/job/solgov/bolt/engineer",
			"slots": 1
		}
	},
	"enabled": false
}
