{
	"$schema": "https://raw.githubusercontent.com/CeladonSS13/Shiptest/beta-dev/_maps/_mod_celadon/ship_config_schema.json",
	"map_name": "Caravan-class Modular ship",
	"map_short_name": "Caravan",
	"description": "Caravan - относительно новое грузовое судно, созданное на основе модульной системы капсул, которая позволяет судну выполнять различные функции, помимо простой транспортировки. Эти капсулы сконструированы на основе быстросъемного механизма, который позволяет главному корпусу прыгать в голубое пространство, отсоединять капсулы и загружать новый набор пустых капсул типа Caravan за считанные минуты. Хотя в теории это впечатляет, отсутствие пустых совместимых грузовых капсул в пространстве Фронтира делает систему быстрого отсоединения бесполезной. Кроме того, модульная система крепления подвержена износу, что требует более частого и дорогостоящего обслуживания, чем у других грузовых суден. Несмотря на эти недостатки, 'Caravan' заслужил репутацию универсальной платформы для самых разных миссий. Основной корпус оснащен надежной силовой установкой и достойными местами для экипажа, а большинство суден на Фронтире оснащены капсулами, предназначенными для добычи полезных ископаемых и проведения исследований. В ЩИТСПАВНЕ ПО ПРИЧИНЕ: Наличие ТЭГа убивает сервер!",
	"map_path": "_maps/_mod_celadon/shuttles/independent/independent_caravan.dmm",
	"enabled": true,
	"limit": 1,
	"sensor_range": 4,
	"prefix": "ISV",
	"faction": "/datum/faction/independent",
	"tags": [
		"Исследовательский"
	],
	"namelists": [
		"GENERAL",
		"SPACE",
		"MYTHOLOGICAL",
		"NATURAL"
	],
	"job_slots": {
		"Captain": {
			"outfit": "/datum/outfit/job/independent/captain/western",
			"officer": true,
			"slots": 1
		},
		"Ship's Doctor": {
			"outfit": "/datum/outfit/job/independent/doctor",
			"slots": 1
		},
		"Engine Technician": {
			"outfit": "/datum/outfit/job/independent/atmos",
			"slots": 1
		},
		"Asteroid Miner": {
			"outfit": "/datum/outfit/job/independent/miner",
			"slots": 1
		},
		"Fauna Researcher": {
			"outfit": "/datum/outfit/job/independent/scientist",
			"slots": 1
		},
		"Assistant": {
			"outfit": "/datum/outfit/job/independent/assistant",
			"slots": 1
		}
	}
}
