{
	"$schema": "https://raw.githubusercontent.com/CeladonSS13/Shiptest/beta-dev/_maps/_mod_celadon/ship_config_schema.json",
	"map_name": "Santiana-class Contrabandist",
	"map_short_name": "Santiana",
	"description": "Боевая шхуна контрабандистов - пиратов. Собранная на скорую руку за самую низкую плату на рынке - эта модель замечается на окраинах космоса в качестве манёвренной и быстрой посудины для доставки и получения контрабанды от разных поставщиков. Благодаря некоторым махинациям, данное судно обзавелось каргопадом и маяком черного рынка, блягодаря чему они стали незаменимыми помощниками для других любителей незаконной деятельсности у которых нет доступа на общественный рынок. Также он популярен у чёрных трансплантологов благодаря достаточно хорошо укопмлектованому мед-отсеку (по меркам контрабандистов).",
	"map_path": "_maps/_mod_celadon/shuttles/pirate/pirate_santiana.dmm",
	"enabled": true,
	"limit": 1,
	"sensor_range": 4,
	"space_spawn": true,
	"prefix": "RSV",
	"faction": "/datum/faction/pirate",
	"tags": [
		"Специализированный",
		"Торговый",
		"РП Фокус"
	],
	"namelists": [
		"PIRATES",
		"NATURAL_AGGRESSIVE"
	],
	"job_slots": {
		"Kapitan": {
			"outfit": "/datum/outfit/job/pirate/captain",
			"officer": true,
			"slots": 1
		},
		"Abordajnik": {
			"outfit": "/datum/outfit/job/pirate/security",
			"slots": 1
		},
		"Povar": {
			"outfit": "/datum/outfit/job/independent/cook",
			"slots": 1
		},
		"Motorist": {
			"outfit": "/datum/outfit/job/pirate/engineer",
			"slots": 1
		},
		"Korabelniy vrach": {
			"outfit": "/datum/outfit/job/pirate/medic",
			"slots": 1
		},
		"Yunga": {
			"outfit": "/datum/outfit/job/pirate/assistant",
			"slots": 1
		}
	}
}
