{
	"$schema": "https://raw.githubusercontent.com/CeladonSS13/Shiptest/beta-dev/_maps/_mod_celadon/ship_config_schema.json",
	"map_name": "Hyena-class Wrecking Tug",
	"map_short_name": "Hyena",
	"description": "«Hyena» обычный спасательный буксир, который часто используется «Мародерами Горлекса» для «спасательных» миссий на заброшенные станции эпохи Второй Галактической войны (а, иногда и на аванпосты и судна). 'Hyena' имеет довольно компактную планировку со специальным безопасным складским помещением и довольно большим грузовым отсеком для своего размера, а также комплектом высококачественных костюмов и шахтёрского оборудования. Низкая стоимость Hyena и высокий спрос в ее нише сделали ее очень распространенным явлением в дальних секторах космоса в годы, последовавшие за войной. и несмотря на ограниченное финансирование, почти все отколовшиеся от фракции Мародёров Горлекса продолжают приобретать такие типы суден ещё больше.",
	"map_path": "_maps/_mod_celadon/shuttles/syndicate/syndicate_gorlex_hyena.dmm",
	"enabled": true,
	"limit": 1,
	"sensor_range": 3,
	"prefix": "DSSV",
	"faction": "/datum/faction/syndicate",
	"tags": ["Шахтерский"],
	"namelists": [
		"GORLEX",
		"NATURAL_AGGRESSIVE",
		"BEASTS",
		"WEAPONS",
		"ACLF"
	],
	"job_slots": {
		"Captain": {
			"outfit": "/datum/outfit/job/syndicate/cel/captain/gorlex",
			"officer": true,
			"slots": 1
		},
		"Foreman": {
			"outfit": "/datum/outfit/job/syndicate/cel/ce/ngr",
			"officer": true,
			"slots": 1
		},
		"Mechanic": {
			"outfit": "/datum/outfit/job/syndicate/cel/engineer/gorlex",
			"slots": 1
		},
		"Wrecker": {
			"outfit": "/datum/outfit/job/syndicate/cel/miner/gorlex",
			"slots": 2
		},
		"Junior Agent": {
			"outfit": "/datum/outfit/job/syndicate/cel/assistant/gorlex",
			"slots": 2
		}
	}
}
