{
	"$schema": "https://raw.githubusercontent.com/shiptest-ss13/Shiptest/master/_maps/ship_config_schema.json",
	"map_name": "Elegia-class War Galeon",
	"map_short_name": "Elegia",
	"description": "Исследовательский корвет под названием Элегия предназначен для исследовательских задач, ведь он может находиться длительное время на самообеспечении. Основной целью является исследование планет и фауны. Для этого он оснащен шахтёрским инвентарём, боевым оружием и средствами стабилизации полевых оперативников, а также специальным медицинским боргом Синдиката.",
	"map_path": "_maps/_mod_celadon/shuttles/syndicate/syndicate_elegia.dmm",
	"enabled": true,
	"limit": 1,
	"sensor_range": 6,
	"prefix": "BSSV",
	"faction": "/datum/faction/syndicate",
	"tags": ["Боевой"],
	"namelists": [
		"GORLEX"],
	"job_slots": {
		"Hardliner's Captain": {
			"outfit": "/datum/outfit/job/cel/syndicate/captain/gorlex",
			"officer": true,
			"slots": 1
		},
		"Hardliner's Doctor": {
			"outfit": "/datum/outfit/job/cel/syndicate/paramedic/gorlex",
			"slots": 1
		},
		"Hardliner's mechanic": {
			"outfit": "/datum/outfit/job/cel/syndicate/engineer/gorlex",
			"slots": 1

		},
		"Hardliner's Operative": {
			"outfit": "/datum/outfit/job/cel/syndicate/security/gorlex",
			"slots": 3
		},
		"Hardliner's miner": {
			"outfit": "/datum/outfit/job/cel/syndicate/miner/gorlex",
			"slots": 2
		},
		"Junior Agent": {
			"outfit": "/datum/outfit/job/cel/syndicate/assistant/gorlex",
			"slots": 2
		}
	}
}
