{
	"$schema": "https://raw.githubusercontent.com/shiptest-ss13/Shiptest/master/_maps/ship_config_schema.json",
	"map_name": "Atlas-class Drug Production Vessel",
	"map_short_name": "Atlas",
	"description": "Корветы класса «Atlas» когда-то использовались Республикой Элизиум, но несколько десятилетий назад были законсервированы. Сегодня корабли используются Сепаратистами Элизиума как корабли снабжения и полевого производства столь необходимых сепаратистам ветвей амброзии. Многие из них выгорели изнутри в плазменных пожарах из-за фатального несоблюдения техники безопасности при транспортировке газообразной плазмы. На них также находятся субшаттлы класса 'Felon', которые теперь используются для быстрой переброски (обычно контрабандных) припасов.",
	"map_path": "_maps/_mod_celadon/shuttles/elysium/elysium_atlas.dmm",
	"enabled": true,
	"limit": 1,
	"sensor_range": 3,
	"prefix": "EUSM",
	"faction": "/datum/faction/elysium",
	"tags": [
		"RP Focus",
		"Botany",
		"Cargo",
		"Subshuttle"
	],
	"namelists": [
		"WEAPONS",
		"BEASTS"
	],
	"job_slots": {
		"Caid": {
			"outfit": "/datum/outfit/job/elysium/captain",
			"officer": true,
			"slots": 1
		},

		"Mukatell": {
			"outfit": "/datum/outfit/job/elysium/security",
			"slots" : 1
		},
		"Ahisa`i": {
			"outfit": "/datum/outfit/job/elysium/assistant",
			"slots": 5
		}
	}
}
