{
	"$schema": "https://raw.githubusercontent.com/shiptest-ss13/Shiptest/master/_maps/ship_config_schema.json",
	"map_name": "Cirrus-class Medical Carrack",
	"map_short_name": "Cirrus-class",
	"description": "Cirrus-class — это проект Cybersun, созданный для  предоставления услуг Trauma Team в дали от основных объектов Cybersun. Он полностью оборудован для автономной работы судна, а также имеет пристыкованный к нему шаттл класса Gauze, для высадки Trauma Team к пострадавшим.",
	"map_path": "_maps/_mod_celadon/shuttles/syndicate/syndicate_cybersun_cirrus.dmm",
	"starting_funds": 1000,
	"enabled": true,
	"limit": 1,
	"sensor_range": 5,
	"prefix": "MSSV",
	"faction": "/datum/faction/syndicate",
	"tags": ["Медицинское"],
	"namelists": [
		"CYBERSUN",
		"SPACE",
		"NATURAL_AGGRESSIVE"
	],
	"job_slots": {
		"Captain": {
			"outfit": "/datum/outfit/job/syndicate/captain/cybersun",
			"officer": true,
			"slots": 1
		},
		"Medical Director": {
			"outfit": "/datum/outfit/job/syndicate/cmo",
			"officer": true,
			"slots": 1
		},
		"Cybersun Ambassador": {
			"outfit": "/datum/outfit/job/syndicate/head_of_personnel/cybersun",
			"officer": true,
			"slots": 1
		},
		"Cybersun Technician": {
			"outfit": "/datum/outfit/job/syndicate/engineer/cybersun",
			"slots": 1
		},
		"Cybersun Medical Specialist": {
			"outfit": "/datum/outfit/job/syndicate/doctor/cybersun",
			"slots": 2
		},
		"Trauma Team Technician": {
			"outfit": "/datum/outfit/job/syndicate/paramedic/cybersun",
			"slots": 2
		},
		"Ship's Aide": {
			"outfit": "/datum/outfit/job/syndicate/assistant/cybersun",
			"slots": 2
		}
	}
}
