{
	"$schema": "https://raw.githubusercontent.com/CeladonSS13/Shiptest/beta-dev/_maps/_mod_celadon/ship_config_schema.json",
	"map_name": "Bubble-class Colonial Ship",
	"map_short_name": "Bubble",
	"map_path": "_maps/_mod_celadon/shuttles/independent/independent_bubble.dmm",
	"description": "В то время как самые известные судна-колонии были громадными, высокоразвитыми кораблями, предназначенными для переправки сотен, а то и тысяч поселенцев в далекие миры и создания городов за считанные месяцы - Каликсианский Лунный свет, Кандор, Первый поезд в Форт-Сол, - судно класса 'Bubble' предназначен для тех, кто хочет основать небольшое ранчо или деревню на просторах космоса. Bubble очень компактны, но оснащены всем необходимым для создания колонии - обширным научно-исследовательским оборудованием, надежной добывающей техникой и карго подом для быстрой продажи культуры/руды и других продуктов от производства колонии. Несмотря на то, что исторически корабли класса 'Bubble' использовались Соларианской Федерацией для создания колоний, их собственная версия недавно была снята с эксплуатации.",
	"enabled": true,
	"limit": 1,
	"sensor_range": 3,
	"prefix": "ISV",
	"faction": "/datum/faction/independent",
	"tags": ["Исследовательское"],
	"namelists": [
		"GENERAL",
		"SPACE"
	],
	"job_slots": {
		"Captain": {
			"outfit": "/datum/outfit/job/independent/captain",
			"slots": 1
		},
		"Scientist": {
			"outfit": "/datum/outfit/job/independent/scientist",
			"slots": 1
		},
		"Engineer": {
			"outfit": "/datum/outfit/job/independent/engineer",
			"slots": 1
		},
		"Miner": {
			"outfit": "/datum/outfit/job/independent/miner",
			"slots": 1
		},
		"Assistant": {
			"outfit": "/datum/outfit/job/independent/assistant",
			"slots": 3
		}
	}
}
